### ISSUE TITLE
can not see any clients on the network  while scanning

### ISSUE THREAD

**Issue by br0k3ngl255** [royhills/arp-scan#2]
Hi,
I am using arp-scan for a short time,( by the way , greap tool for all most everything), and i stumble upon this thing, could be a bug , not sure : 
when i am trying to scan LAN with wireless interface, i am not getting any clients not even the gateway. i tryed to  change router config, thinking that there might be some rule in firewall, that might block the arp but i didn't find anything( i flushed iptables and it still didn't work ).
hardware description : 
Wireless interface : ALFA Netrwork- AWUS036H
OS : debian, Kali, Fedora( i have checked in different OSes just to verify)
Router:  TP-Link 1043 with openwrt 12.09 on it.
If any other info is needed please notify.
thanks in advance

**Comment by royhills** [comment]
I suspect this has been resolved. Closing.

**Comment by defanator** [comment]
@royhills I'm seeing exactly the same behavior on the TP-LINK Archer C7 running under OpenWRT 18.06.4.

Here's the command:

```
# arp-scan -I br-lan 10.7.7.77
Interface: br-lan, datalink type: EN10MB (Ethernet)
Starting arp-scan 1.9.2 with 1 hosts (http://www.nta-monitor.com/tools-resources/security-tools/arp-scan/)

2 packets received by filter, 0 packets dropped by kernel
Ending arp-scan 1.9.2: 1 hosts scanned in 4.752 seconds (0.21 hosts/sec). 0 responded
```

Here's the dump:

```
13:56:08.262408 ARP, Ethernet (len 6), IPv4 (len 4), Request who-has 10.7.7.77 tell 10.7.7.10, length 28
13:56:08.262621 ARP, Ethernet (len 6), IPv4 (len 4), Reply 10.7.7.77 is-at 00:9c:02:ab:df:00, length 46
13:56:08.766699 ARP, Ethernet (len 6), IPv4 (len 4), Request who-has 10.7.7.77 tell 10.7.7.10, length 28
13:56:08.768816 ARP, Ethernet (len 6), IPv4 (len 4), Reply 10.7.7.77 is-at 00:9c:02:ab:df:00, length 46
```

**Comment by royhills** [comment]
Re-opening now we have more than one reported instance.

**Comment by defanator** [comment]
@royhills here's the dump with actual package date, just for the reference (my only guess so far is endianness):

```
# tcpdump -xxvni br-lan 'arp'
tcpdump: listening on br-lan, link-type EN10MB (Ethernet), capture size 262144 bytes
14:05:18.866049 ARP, Ethernet (len 6), IPv4 (len 4), Request who-has 10.7.7.77 tell 10.7.7.10, length 28
	0x0000:  ffff ffff ffff 30b5 c284 89b2 0806 0001
	0x0010:  0800 0604 0001 30b5 c284 89b2 0a07 070a
	0x0020:  0000 0000 0000 0a07 074d
14:05:18.866347 ARP, Ethernet (len 6), IPv4 (len 4), Reply 10.7.7.77 is-at 00:9c:02:ab:df:00, length 46
	0x0000:  30b5 c284 89b2 009c 02ab df00 0806 0001
	0x0010:  0800 0604 0002 009c 02ab df00 0a07 074d
	0x0020:  30b5 c284 89b2 0a07 070a 0000 0000 0000
	0x0030:  0000 0000 0000 0000 0000 0000
14:05:19.366612 ARP, Ethernet (len 6), IPv4 (len 4), Request who-has 10.7.7.77 tell 10.7.7.10, length 28
	0x0000:  ffff ffff ffff 30b5 c284 89b2 0806 0001
	0x0010:  0800 0604 0001 30b5 c284 89b2 0a07 070a
	0x0020:  0000 0000 0000 0a07 074d
14:05:19.366868 ARP, Ethernet (len 6), IPv4 (len 4), Reply 10.7.7.77 is-at 00:9c:02:ab:df:00, length 46
	0x0000:  30b5 c284 89b2 009c 02ab df00 0806 0001
	0x0010:  0800 0604 0002 009c 02ab df00 0a07 074d
	0x0020:  30b5 c284 89b2 0a07 070a 0000 0000 0000
	0x0030:  0000 0000 0000 0000 0000 0000
^C
4 packets captured
5 packets received by filter
0 packets dropped by kernel
```

**Comment by royhills** [comment]
The latest reported issue on OpenWRT 18.06.4 looks a lot like the recent issue with libpcap 1.9.1 reported in #42. But https://openwrt.org/packages/pkgdata/libpcap shows that OpenWRT is using libpcap 1.8.1 which should work OK:

Name:    libpcap
Version:    1.8.1-1
Description:  This package contains a system-independent library for user-level network packet\\ capture. \\ \\

Big endian shouldn't be an issue in theory, but needs to be tested as just about all the test systems have been little endian x86/amd64 based.

**Comment by defanator** [comment]
@royhills libpcap version at the router:

```
# opkg info libpcap
Package: libpcap
Version: 1.9.1-1
Depends: libc
Status: install user installed
Section: libs
Architecture: mips_24kc
Size: 93213
Filename: libpcap_1.9.1-1_mips_24kc.ipk
Description: This package contains a system-independent library for user-level network packet
 capture.
Installed-Time: 1571726852
```

**Comment by royhills** [comment]
Thanks for the info.  The problem is probably the libcap 1.9.1 incompatability reported in #42 and fixed in arp-scan 1.9.6.

Is it possible to build arp-scan from source on this system? (I'm not sure if OpenWRT includes build tools).  In theory, it's possible to cross-compile, but I've never done it so the autoconf support for this hasn't received much testing.

I guess the other option would be to ask the OpenWRT package maintainer to package up arp-scan 1.9.6.

**Comment by defanator** [comment]
@royhills yes, I have an access to a device with installed gcc and other build tools. I also have a little experience of cross-compiling for OpenWrt (https://github.com/defanator/mcespi + https://github.com/defanator/openwrt-crossbuild-env). Going to give it a try.

**Comment by defanator** [comment]
@royhills I can confirm that 1.9.6 works just fine:

```
root@archer-c7-v2:~# arp-scan -I br-lan --localnet
Interface: br-lan, datalink type: EN10MB (Ethernet)
Starting arp-scan 1.9.2 with 256 hosts (http://www.nta-monitor.com/tools-resources/security-tools/arp-scan/)

16 packets received by filter, 0 packets dropped by kernel
Ending arp-scan 1.9.2: 256 hosts scanned in 4.102 seconds (62.41 hosts/sec). 0 responded
root@archer-c7-v2:~# 
root@archer-c7-v2:~# ./arp-scan -I br-lan --localnet
Interface: br-lan, type: EN10MB, MAC: 30:b5:c2:84:89:b2, IPv4: 10.7.7.10
Starting arp-scan 1.9.6 with 256 hosts (https://github.com/royhills/arp-scan)
10.7.7.1	e8:de:27:c6:eb:de	TP-LINK TECHNOLOGIES CO.,LTD.
10.7.7.77	00:9c:02:ab:df:00	Hewlett Packard

2 packets received by filter, 0 packets dropped by kernel
Ending arp-scan 1.9.6: 256 hosts scanned in 3.857 seconds (66.37 hosts/sec). 2 responded
```

I'll reach out to the maintainer with these findings and suggest to update OpenWrt package.

Thanks for the great tool!
